<?xml version="1.0" encoding="UTF-8" ?>
<calculation
        xmlns="http://iit.uni.miskolc.hu/webtech2/nodejs/calculator"
        xmlns:xsi="http://www.w3.org/2001/XMLSchema-instance"
        xsi:schemaLocation="http://iit.uni.miskolc.hu/webtech2/nodejs/calculator calculatorDTO.xsd"
>
<firstOperand>
    <calculation>
        <firstOperand>5</firstOperand>
        <operation>+</operation>
        <secondOperand>3</secondOperand>
    </calculation>
</firstOperand>
    <operation>-</operation>
    <secondOperand>3</secondOperand>
</calculation>